ID,Title_CN,Fable_CN,Moral_CN,TOC
74,男孩和榛子,一个小男孩把手伸进装满榛子的瓶中，用尽全力去抓了一大把。但当他想要缩回手时，却发现根本出不来，因为相对于他那抓满榛子的手来说，瓶口太小了。他既不想放弃手中的一部分榛子，又不能拿出手来，于是大哭起来。一个旁观者看出了他的麻烦，便对他说："孩子，不要太贪婪，只要少拿一半，你的手就能很容易地出来了。",不要总想一口吃成个大胖子。,其他
75,青蛙求王,因为缺少一个统领者，青蛙们大为不悦。于是，他们派了一个代表去拜见朱庇特，请求赐给他们一个国王。朱庇特不屑于他们如此愚蠢的请求，便将一根木头扔到青蛙居住的池塘中，并且说这就是他们的国王。刚听到木头落下的声音时，青蛙们都吓了一大跳，纷纷潜入池塘深处；没过多久，当他们发现木头依旧静止在那里时，一个接一个地又游出水面来；不久之后，他们愈发大胆了，发现木头没什么了不起的，甚至于爬上木块，坐在它的上面。他们认为这样一个国王简直是对自己尊严的侮辱，于是又去求见朱庇特，请求把赐予他们的这个木头疙瘩拿走，再换一个更好的国王。朱庇特对此十分生气，便派了一只鹳去管制青蛙。结果，鹳一来到池塘里，便开始全力逮吃青蛙。,莽撞的请求常常会带来反作用，你所得到的正是你自己所请求的，但未必会是你想要的结果。,青蛙
76,橄榄树与无花果树,在某一个季节，橄榄树讥笑无花果树的叶子全都凋零了。她说："你的树叶一到秋天就会逐渐凋落，等到春天时才会再次长出来；而我的叶子就像你看到的这样，一年四季都是常青的。"正当他夸夸其谈时，突然下起了大雪，雪花全都压在橄榄树的叶子上，不一会儿就把他压垮了；而光秃秃的无花果树，一点也没被雪花伤害，反倒生存下来等待着来年的绽放。,美丽的外表并不是值得炫耀的资本。,其他
77,狮子和野猪,炎热的夏季，难耐的酷暑使人口渴，一只狮子和一只野猪同时来到一个小泉边喝水。他们立刻为谁应该先喝水而争吵起来。很快，争吵升级成了战争，他们互相攻击，斗得你死我活。就在他们喘气休息时，忽然回过头去，看见几只秃鹰正坐在岩石上，显然他们正在等着看谁先败下阵来，接着就会冲过来吃掉那个尸体。一看到秃鹰，他们立刻停止了争斗，说："我们还是成为朋友吧，总比相互争斗并被秃鹰吃掉好得多。",即使在争斗的情况下，只要有更大的威胁出现，双方也能和平解决问题，团结同心是人类克服困难的唯一出路。,其他
78,核桃树,有一棵长在路旁的核桃树，每年都能结很多核桃。为了得到树上的核桃，几乎每个路过的人都会用枝条和石头去敲打它。核桃树暗自悲叹自己所遭受的痛苦，自言自语道："我真倒霉，每一个享用我的果实的人，都会用这样无情的损害与鞭打来回报我。",即使付出代价，也要慷慨地付出回报以示感谢。,其他
79,人和同行的狮子,有一次，狮子与人同行，交谈中他们开始吹嘘各自的英勇，双方都强调自己更勇敢。就这样面红耳赤地争吵着，他们来到了一个十字路口，看到塑像上雕刻着一个人征服几头狮子的场景。那个人立刻得意洋洋地说："你看那里，事实证明我们比你们强得多了吧。""不要急，我的朋友，"狮子笑着说，"这只是你们的看法而已。如果狮子会雕刻，你就会看见众多人败倒在狮子脚下了。",任何问题都有两面性。,其他
80,乌龟和老鹰,一只乌龟，不满足于自己的地面生活，很羡慕鸟儿能在空中玩耍，于是便请求老鹰教他飞翔。老鹰劝他，这是他的一个白日梦，因为大自然并没有赋予他可以飞翔的翅膀。可是乌龟再三恳求，还用珍宝利诱老鹰，一再坚持这只是一个了解如何在空中飞翔的问题。于是，老鹰为了满足乌龟的愿望，一把抓起他，带着乌龟飞到一定高度后，就松开了鹰爪，而乌龟则落在了岩石上，被摔得粉身碎骨。,不要不切实际地追求太大的梦想，否则可能会被无知所害。,其他
81,站在屋顶的小山羊与狼,被青草和其它东西所吸引的一只小山羊，爬到了屋外的草棚顶上。就在他四处观望时，看见一只狼从底下经过，便嘲笑他抓不到自己。狼只是抬眼看了一下，说道："嘿，伙计，笑话我的可不是你，而是你所处的地势。",不要轻视他人，要看到自身处境的实际情况。,狼
82,断尾巴狐狸,有一只狐狸曾经落入捕兽器的圈套，经过一番斗争，他终于逃脱了，但却失去了一条尾巴。经此劫难，他觉得自己脸上无光，还不如一死了之，除非能够劝说其它狐狸也舍弃自己的尾巴，这样大家就不会再关注他的断尾了。于是他召集了所有狐狸开会，劝说他们也割掉自己的尾巴，他当众宣称："你们的尾巴实在太难看了，一直带着尾巴四处走，这简直太让人厌恶了。"然而，有一只狐狸站出来反驳道："喂，朋友，如果你没有丢掉自己的尾巴，就不会这样煞费苦心地来劝说我们了。",不要以自己的损失来劝说别人，自己身上的不完美并不代表别人的不完美。,狐狸
83,爱慕虚荣的寒鸦,朱庇特想在鸟类中指定一个王，便指定了一个日子，令百鸟全都按时出席，届时他将挑选其中最美丽的鸟为百鸟之王。为了展现自己最好的一面，众鸟都跑到河里忙于梳理自己的羽毛。像那些有自知之明的鸟一样，寒鸦也意识到自己的丑陋，根本不可能被选为百鸟之王，于是他在河边等着众鸟散去，捡起他们脱落下的羽毛，小心翼翼地全固定在自己身上，结果他看上去比其它鸟都华丽。指定的日子来临了，众鸟都来到朱庇特的王位前。浏览了一遍眼前的众鸟，朱庇特决定立寒鸦为王。为了王位大选而来的其它鸟，纷纷从寒鸦身上拔下本属于自己的羽毛，暴露出寒鸦那丑陋的本来面目。,不要试图使自己表现的特别，因为真正的优秀就是你自己。,其他
84,旅人和他的狗,有一个人正准备踏上一段旅途，于是对正在门口站着打呵欠的狗说："你还站在那里打什么呵欠呀？快点过来，一切都准备好了，就差你跟我走了！"但是，狗却摇着尾巴，静静地回答说："我早就准备好了，倒是一直在等你呢。",准备旅行的人常会等待他人，而有时候可能是自己才是最后一位准备好的人。,狗
85,遇难者与海,一个遇上海难的人经过一番风浪里的挣扎，终于被冲上岸，他筋疲力尽地躺在沙滩上睡着了。不一会儿，当他醒过来后，便开始指责大海总以平静、温和的外表引诱人们，然而，就在人们上当受骗之后，大海就变得凶暴和残忍，最终致使船和船上的人同归于尽。这时，大海以女人的形象出现了，并且对他说："喂，朋友，你别责怪我，应该责怪风！我本是平静的，但是只要风猛然刮过来，就会掀起惊涛骇浪，使我变得残暴。这并不是我的本性。",不要把不可抗拒的灾难怪罪于他人，有时候，事情往往不会如自己所预期，所以要注意准备，以应对可能发生的险情。,其他
86,野猪与狐狸,一头野猪在森林里的一棵树干上磨他的牙齿，这时，狐狸走过来，看到野猪在磨牙，便不解地问道："你在做什么，祈祷吗？今天猎人没出来，我也没看到有什么危险来临呀。""的确如此，我的朋友，"野猪回答说，"不过，一旦危险降临，我就可以利用磨好的利牙了。那时根本没有工夫再来磨牙了。",准备即使没有危险来临，也要时刻准备好，以便在危险到来时，可以尽可能地做最好的准备。,狐狸
87,墨丘利与雕刻家,墨丘利急于了解自己有多么受人尊重，便化做一个凡人，来到一个雕刻家的工作室，那里有很多已经完工的雕像正待出售。他看见了一尊朱庇特的雕像，便问要多少钱。"一块银元。"雕刻家回答说。"就这么多？"他笑着问，"那么，"（他指着朱诺的像------朱庇特的妻子）"这一尊要多少钱？"雕刻家回答说："那个要半块银元。""那边那个雕像，你想卖多少钱呢？"他指着自己的雕像继续问道。"那个？"雕刻家说，"假如你要买那两个的话，我便把这个白送给你。",被尊重和赏识的感觉是无价的，它所带来的价值超出了任何金钱或物质的价值。,其他
88,小鹿和妈妈,一只母鹿对已经长大了的小鹿说："我的儿子，自然赋予了你健硕的体魄和一对结实的鹿角，我简直想不到，你为何这么胆小，竟然会从猎狗身边逃跑。"就在这时，母子俩都听到了远处一群猎狗的狂吠声。"你就待在原地吧，"母鹿说，"不要管我。"话音刚落，她就飞也似的跑了。,勇敢面对恐惧，甘愿牺牲自己，给家人更好的未来。,其他
89,狐狸和狮子,有一天，从来没有见过狮子的一只狐狸第一次碰见了狮子，刚看见狮子的一刹那，狐狸竟被吓得半死。没过多久，他又一次遇到了狮子，仍然很害怕，但是已经不像第一次见到时那样了。然而，当狐狸第三次遇到狮子时，他竟有胆量走上前去与狮子交谈，仿佛老朋友一样。,只要勇敢面对恐惧，它就会渐渐消失，而你也会获得勇气来战胜恐惧。,狐狸
90,鹰与捕鹰者,从前，有一个人捉住了一只鹰，随后便剪断了他的翅膀，放入鸡窝中与其它家禽一起饲养，鹰一直待在角落里暗自悲伤，看上去甚为沮丧和绝望。没过多久，捕获老鹰的那个人很高兴地将鹰卖给了一个邻居，邻居把鹰带回家后又帮他长出了新的翅膀。鹰飞出去抓住一只兔子，立刻带回家给恩人。一只狐狸看到后，便对老鹰说："不要在他身上浪费你的猎物！把这份礼物送给以前捕获你的那个人，和他交个朋友，那么，或许他不会再次捕获你，并剪断你的翅膀。",友善待人，厚待敌人，因为你永远不知道明天会有怎样的相遇。,其他
91,铁匠与小狗,铁匠家有一条小狗，小狗常常在主人打铁时睡觉，但是一到了吃饭时间，便异常清醒起来。有一天，铁匠假装对此很生气，一边像往常一样扔给小狗一块骨头，一边说："地球上还有像你一样懒惰的坏蛋吗？你这家伙，总是在我卖力工作时，蜷缩起来睡觉，可是，只要我一停下来吃点东西，你就清醒地摇着尾巴过来讨饭吃。",不卖力工作的人理应挨饿。,狗
92,池边的雄鹿,一只非常口渴的鹿，跑到池塘边去喝水。当他在池边俯下身去喝水时，看到了水面上自己的倒影，一边得意洋洋地欣赏着自己那完美修长的鹿角，一边又为自己的小细腿而闷闷不乐。正当他看得入神时，被一头看见他的狮子袭击了。他拼命地向着空旷、没有树木的平原跑去，很快就摆脱了身后的追逐者。可是，当他跑进一片树林中时，眼看着那美丽的鹿角就被挂在了树枝上，终于被跟踪而来的敌人擒获，成了狮子的美味佳肴。"真是不幸呀！"鹿在临死前哀叹道，"我小瞧了自己的腿，可是它们却救了我的命；我以自己的角为傲，可是它们却葬送了我的性命。",最值得的东西往往被视为最没价值的。,其他
93,叼着肉的狗,一条狗嘴里叼着一块肉，在穿过小河上的一个木板桥时，碰巧看见了水中自己的倒影。他以为是另一条狗叼着一块更大的肉，于是，他扑到水中，想去抢另一条狗嘴里那块更大的肉。然而，他最终什么也没有得到。因为水中那块肉本来就只是个影子，而原来的那块肉也被河水冲走了。,不要追求那些不可能实现的事情，有时候我们更应该珍惜自己拥有的一切。,狗
94,墨丘利与商人,朱庇特在创造人类时，吩咐墨丘利制造一点让人说谎的药，并添加到其他要素上，从而形成商人。墨丘利遵命研制好药之后，依次平均地添加到每种生意人身上------卖蜡烛的商贩、卖蔬菜瓜果的商贩、卖杂货的商贩等。最后轮到了马贩子，这是最后一个要添药的商人了，但是墨丘利却发现还剩下很多药，于是，他便将剩余的药全部加在了马贩子身上。这正是商人多少都会说谎的原因，尤其是马贩子更为厉害。,比起其他商人，马贩子更容易说谎。,其他
95,老鼠和黄鼠狼,老鼠和黄鼠狼打起仗来，老鼠每次都处于劣势，大量老鼠都被黄鼠狼杀死并吃掉了。于是，他们召开了一次战事会议，其中，一个年长的老鼠站起来发言："毫无疑问，我们总是被打败的一方，因为没有统领来规划我们的战斗，在战场上指挥我们的行动，所以才会屡次失败。"根据他的建议，老鼠们推选出那些个头大的老鼠作为带队将领，并且，为了在老鼠群中区分这些将领，还让他们戴上用草编成的头盔。然后，老鼠带着必胜的信心再次投入到战斗中。可是，他们依旧被打败了，鼠群纷纷逃回洞中。除了那些将领之外，所有老鼠都轻易地逃进了洞里，因为头盔妨碍他们钻进小小的老鼠洞，所以将领们都被黄鼠狼吃掉了。,伟大的形象也要付出代价。,狼
96,孔雀和朱诺,因为自己没有夜莺那悠扬动听的歌声，孔雀大为不悦，于是跑到朱诺面前抱怨。"所有的鸟都羡慕夜莺的歌声，"她说，"但是，只要我一开口发声，就成了大家的笑料。"女神朱诺为了尽量安慰她，说道："你的确没有唱歌的优势，但是你却有着超凡的美丽外表。你的脖子闪耀着绿宝石一样的光辉，你那开屏的尾巴更是华丽富贵、光彩照人。"然而，孔雀仍旧不满足。"我的声音那么难听，"孔雀说，"美丽又有什么用呀？"朱诺接着回答说："命运赋予了每个人不同的礼物------赋予了你无比的美丽，赋予了老鹰强大的力量，赋予了夜莺优美的歌声，以此类推下去，所有生命都有着各自的特征，而你却不满足于自己所拥有的。不要再抱怨了，因为如果你当下的愿望得到了满足，很快你又会找到另一个不满足的借口。",要满足当下，并尊重命运赋予你们的独特能力，不要再抱怨与他人相比自己所拥有的优势不多，因为你永远无法得到所有的，如果你得到了你所需要的，你可能会再找到新的不满足的原因。,其他
97,熊与狐狸,有一只熊曾经大肆鼓吹自己多么仁慈，与其它动物相比，自己是多么文雅。（其实，绝不碰死人是熊的一贯传统。）一只狐狸听到这些话，面带微笑地对熊说："我的朋友，当你饥饿难耐时，我希望你也能将注意力集中在死人身上，不再吃活人了！",骗子只会掩耳盗铃似的欺骗自己。,狐狸
98,驴和老农夫,一位老农民正坐在草地上看驴，驴被紧紧盯着。突然农民看到全副武装的人们走近，便立刻跳了起来，恳请驴跟他一起尽快飞走。"否则，"他说，"我们便会被敌人逮住。"驴只是懒懒地看了看，便说："如果这样的话，你不认为他们会让我驮更重的东西？""不，"主人说。"哦，那么，"驴说，"我不介意他们把我抓走，我再也不会比现在更糟了。",当我们面临危机时，如果不积极主动改变，我们可能会处于更糟的境地。,驴
99,牛和青蛙,两只小青蛙在池塘边玩耍时，一头公牛走到水边去喝水，结果不小心踩扁了其中一只小青蛙，使其当场毙命。青蛙妈妈发现小青蛙不见了，便问另一只小青蛙，他的兄弟到哪里去了。"妈妈，他死了。"小青蛙说，"今天上午有一个长着四只脚的巨型怪物来到水塘边，把我的兄弟踩进了泥巴里。""巨型兽？是不是这么大？"青蛙妈妈一边问，一边尽力鼓气，让自己尽量变大一些。"嗯，是的，比这还要大。"小青蛙说。青蛙妈妈再鼓了鼓气，问道："是不是这般大小呢？""对，妈妈，比这个还要再大一些。"小青蛙说。于是，青蛙妈妈又使劲鼓气，几乎快成了一个圆球。"有这么大......"还没等她说完，就把肚子胀破了。,自量力的人，最终会惨遭失败。,青蛙
100,人和神像,一个穷人在家里供奉了一尊木头神像，天天对着神像祈祷让自己发财。持续了相当一段时间后，他依旧像过去那样贫穷。有一天，这个人带着极度的愤怒抓起神像，用尽全力冲着墙壁扔过去。强大的撞击力打破了神像的头，一些金币纷纷掉在了地板上。这个人贪婪地抓起金币，说："哦，你这个大骗子！我好好供奉你的时候，你却什么都不给我；等我用暴力对待你的时候，你却让我成了富翁！",不要依赖外力，要靠自己努力才能获得成功。,其他
101,赫刺克勒斯和车夫,有一个车夫驾着一辆载着货物的马车，正当他沿着乡间小路前进时，车轮突然深陷入泥坑中，拉车的马无论如何也挪不出车轮来。车夫站在那里，无助地四处观望，大声呼喊着大力神前来帮忙。大力神赫刺克勒斯终于出现了，对他说："先用你的肩膀顶住车轮，再用鞭子赶你的马，试着这样做了之后，再来祈求我的帮助。如果你不能先自助，就不能期望大力神或其他人来帮你了。",自助者，天助之。,其他
102,石榴树、苹果树和野蔷薇,石榴树与苹果树为谁的果实质量最好而争吵不休，双方都认为自己的更好。愤怒的话语相继从他们的嘴里脱口而出，激烈的争吵马上就要升级了，这时，野蔷薇嬉皮笑脸地从隔壁篱笆丛中探出头来，说："够了，朋友们，我们不要再争吵了。",寓意是：保持和平、友好、尊重他人。,其他
103,狮子、熊和狐狸,狮子和熊同时抓到了一只小羊羔，他们俩为争夺小羊羔凶狠地打了起来。经过一场苦斗，双方都受了重伤，有气无力地躺在地上。一只狐狸早已躲在远处观望着，一见他们俩都直挺挺地躺在地上虚弱地一动不动，他便溜过去抓起羊羔，一溜烟地跑掉了。狮子和熊眼睁睁地看着狐狸抢走了小羊羔，却也毫无办法，只能唉声叹气地说："我们俩斗得两败俱伤，却让狐狸得到了好处！",这篇文章的寓意是：不要因为小利把自己弄得不健康，否则可能会让他人从中受益。,狐狸
104,两个士兵和强盗,两个士兵一起赶路，途中被一个强盗所劫。其中一个士兵马上逃跑了，另一个则勇敢地握着剑立在原地，强盗不得不弃他而逃。这时，那个胆小的士兵跑过来，抽出剑，壮着胆大喝一声："他去哪里了？让我来对付他，我要让他知道面对的是什么人。"然而，那名勇敢的士兵说："你来晚了，我的朋友。要是你刚才能来帮我就好了，即便只是嘴上这样说也好，因为我会受到你这番话的鼓舞，并且相信这些话都是真的。而现在，还是请你把剑收好，已经没有必要再用它了。你只能欺骗其他人，让人们以为你像雄狮一样勇敢；而我却知道，在遇到危险时，你会像兔子一样落荒而逃。",本文的寓意是：勇敢的行为比谎言更能彰显一个人的英勇，表达压力下也会表现出自己真正的性格。,其他
105,狮子和野驴,一只狮子和一头野驴联合外出觅食------野驴能以超快的速度追赶猎物，而狮子则能迅速赶来捕获猎物。他们成功地抓获了猎物，然后，狮子把猎物分成了三份。"我来拿第一份，"狮子说，"因为我是百兽之王；第二份也归我，因为作为你的合作者，我理应分享剩下的一半；至于这第三份，除非你自愿让给我，然后乖乖地滚开，否则你一定会为此而抱憾终身！",强者为王。,驴
106,人与森林之神萨堤罗斯,从前，有个人与森林之神萨堤罗斯成了朋友，他们决定一起生活。在一段时间内，一切都很顺利，直到冬季里的一天，萨堤罗斯看到那个人把手放到嘴边不断地呵气。"你为什么要这样做？"他问道。"为了暖和我的手呀。"那人回答道。就在同一天，他们坐下来一起吃饭，每人面前都摆着一碗热气腾腾的粥，那人举起碗来对着嘴又开始吹气。"你为什么要这样做？"森林之神又问他。"为了让粥凉下来。"他说。森林之神立刻站起来，说："再见，朋友！我要走了，我无法和你这样的人交朋友，因为你的嘴里一会儿吹热气，一会儿又吹冷气。",这篇文章的寓意是：对于一个人，要保持立场的一致性，而不要反复无常，这样才能保持良好的友谊。,其他
107,卖神像的人,有个人用木头雕刻了墨丘利的像，拿到市场上去卖。因为没有一个买主前来光顾，他便认为自己应该大声叫喊，以此吸引人前来购买。于是，他冲着市场里大喊："卖神像了！卖神像了！一个能给你带来好运并维持好运的神像！"这时，旁边的一个人对他说："喂，朋友，如果你的神像真如你所说，那你为何不自己留下他，好好享受他给你的好运呢？""告诉你吧，"这个人回答道，"他的确能让你有所收获，这是真的，但是需要时间，而我则希望能马上得到钱。",寓意是：有时候，我们想要立刻获得回报，而不是等待慢慢收获。,其他
108,老鹰与箭,鹰站在一块高高的岩石上，用锐利的目光观察着猎物。一个猎人躲藏在山间的裂缝中观察情况，看到鹰之后，一箭射中了他。那箭直插入鹰的前胸，并且破膛而出。受着死亡苦痛折磨的老鹰，转眼又看到了带着鹰毛的箭翎。"啊！命运真残酷！"他哭喊着，"竟然让我这样死去，不过，更为残酷的是，杀死我的箭上竟然还插着鹰的羽毛！",本文寓意是：即使你被自己所珍视的东西所杀害，命运也可能会变得更加残酷。,其他
109,富人和制皮匠,一个富人与制皮匠比邻而居，发现皮匠院子里传出的气味实在让人受不了，便告诉皮匠请他搬家。制皮匠一直在拖延，富人重复说了好多次让他快点搬家，皮匠每次总是说马上就搬，却老是不采取行动。就这样持续了一段时间，富人已经闻惯了皮革的臭气，也就不再非难制皮匠了。,寓意是：不必总是强行催促别人，因为最后的结果你也无法改变。,其他
110,狼、妈妈和孩子,一只饥饿的狼四处寻觅食物。走着走着，他被小孩子的哭声吸引，来到了一个农舍。他在窗下屏息而立，只听到母亲对小孩子说："别哭了，不然我就把你扔出去喂狼。"狼信以为真，以为她真会这样做，便站在门外等着，期待着快点能满足自己的食欲。直到傍晚来临，他又听见母亲在哄小孩子："要是狼真的来了，爸爸就会杀死他的。"狼听了这话后，气愤地赶紧跑开了，他边跑边想："那个房子里的人说的话，一句也不能信。",本文的寓意是：说话要谨慎，不可以轻信他人的言语；信以为真的后果可能是致命的。,狼
111,老太婆和酒瓶,一个老太婆捡到一个空酒瓶，这个瓶子曾经装过价格不菲的稀世美酒，依然还带着浓浓的酒香。她把酒瓶放在鼻孔处，一次又一次贪婪地吸着酒香，并说："啊，多么甜美！连装过酒的空瓶都能留下这样甘美难忘的香味，那瓶子里的酒还真不知道会多么甘美醇香呢。",这篇文章所传达的寓意是：珍贵的东西哪怕只是剩余的香味，都会带给我们难忘的美好回忆。,其他
112,母狮与雌狐,一头母狮与一只狐狸在闲聊自己的孩子，出于母亲的美好愿望，她们都在说自己的孩子多么健康，多么茁壮，多么美丽，多么像自己的父母。"看到我产下的小幼崽，真让人高兴，"狐狸说，接着她又不怀好意地说，"但是我注意到你从未生过两胎或更多的幼崽。""没有，"母狮面无表情地回答道，"可我生下的毕竟是一只狮子。",注重质量，而非数量。,其他
113,毒蛇和锉刀,有条毒蛇爬进铁匠铺里，从一个工具到另一个工具，祈求能给他点可以吃的东西。其中，他向锉刀请求施舍，给他一顿饱餐。可是，锉刀却带着不屑的语气说："你若想从我这里得到东西，那你真是太傻了，我历来只会索取，不会回报。",贪婪之人是最小气的施予者。,其他
